{
  "$schema": "https://json-schema.org/draft/2020-12/schema",
  "title": "VLA A2A v1 Agent Card",
  "type": "object",
  "additionalProperties": true,
  "required": ["name", "description", "version", "protocolVersion", "url", "preferredTransport", "capabilities", "skills"],
  "properties": {
    "name": {"type": "string", "minLength": 1},
    "description": {"type": "string", "minLength": 1},
    "version": {"type": "string", "pattern": "^[0-9]+\\.[0-9]+\\.[0-9]+$"},
    "protocolVersion": {"const": "1.0"},
    "url": {"type": "string", "format": "uri", "pattern": "^https://"},
    "preferredTransport": {"enum": ["JSONRPC", "GRPC", "HTTP+JSON"]},
    "additionalInterfaces": {
      "type": "array",
      "items": {
        "type": "object",
        "required": ["url", "transport"],
        "properties": {
          "url": {"type": "string", "format": "uri", "pattern": "^https://"},
          "transport": {"enum": ["JSONRPC", "GRPC", "HTTP+JSON"]}
        }
      }
    },
    "capabilities": {
      "type": "object",
      "required": ["streaming", "pushNotifications"],
      "properties": {
        "streaming": {"type": "boolean"},
        "pushNotifications": {"type": "boolean"},
        "stateTransitionHistory": {"type": "boolean"}
      }
    },
    "defaultInputModes": {"type": "array", "items": {"type": "string"}},
    "defaultOutputModes": {"type": "array", "items": {"type": "string"}},
    "skills": {
      "type": "array",
      "minItems": 1,
      "items": {
        "type": "object",
        "required": ["id", "name", "description", "tags"],
        "properties": {
          "id": {"type": "string", "pattern": "^[a-z0-9][a-z0-9._-]*$"},
          "name": {"type": "string", "minLength": 1},
          "description": {"type": "string", "minLength": 1},
          "tags": {"type": "array", "minItems": 1, "items": {"type": "string"}},
          "examples": {"type": "array", "items": {"type": "string"}}
        }
      }
    }
  }
}
